{
    "id": "http://LRS/ReviewerLite",
    "type": "object",
    "$schema": "http://json-schema.org/draft-03/schema",
    "required": [
        "reviewerId",
        "hudId",
        "nameFirst",
        "nameLast",
        "remainingCapacity",
        "locationId",
        "reportsTo"
    ],
    "additionalProperties": true,
    "properties": {
        "reviewerId": {
            "description": "The identifier of the object",
            "type": "string"
        },
        "hudId": {
            "description": "The login identifier of the reviewer; the user's HID.",
            "type": "string"
        },
        "nameFirst": {
            "description": "The forename of the reviewer.",
            "type": "string"
        },
        "nameLast": {
            "description": "The family name of the reviewer.",
            "type": "string"
        },
        "remainingCapacity": {
            "description": "The remaining number of reviews the reviewer can have assigned to them.",
            "type": "integer"
        },
        "locationId": {
            "description": "The ID of the geographical location where the reviewer does the review.",
            "type": "string"
        },
        "reportsTo": {
            "description": "The ID of the person who the reviewer reports to.",
            "type": "string"
        },
        "statusCode": {
            "description": "Status of the user; whether they are active (A), inactive (I), or terminated (T).",
            "type": "string"
        }
    }
}
